{
  "argv": [
    "/Users/billy/.local/bin/claude",
    "--session-id",
    "6f1c2a3b-1d2e-4f50-8a9b-0c1d2e3f4a5b",
    "--model",
    "opus",
    "--effort",
    "xhigh",
    "--permission-mode",
    "plan",
    "--name",
    "fm-foreman-s02-2-2",
    "--settings",
    "/x/settings.json",
    "<prompt sha256:aaaaaaaaaaaaaaaaaaaaaaaaaaaaaaaaaaaaaaaaaaaaaaaaaaaaaaaaaaaaaaaa>"
  ],
  "chainId": "6f1c2a3b-1d2e-4f50-8a9b-0c1d2e3f4a5b",
  "claudeVersion": "2.1.304",
  "copyPromptOnCli": false,
  "cwd": "spec",
  "entryPoint": "doNext",
  "envNames": [
    "HOME",
    "PATH",
    "TERM"
  ],
  "exitCode": null,
  "intended": {
    "effort": "xhigh",
    "mode": "plan",
    "model": "opus"
  },
  "kind": "launch",
  "name": "fm-foreman-s02-2-2",
  "observed": null,
  "override": false,
  "pid": 4242,
  "projectId": "3f6a1c2e-8b4d-4e7f-9a1b-2c3d4e5f6a7b",
  "promptSha256": "aaaaaaaaaaaaaaaaaaaaaaaaaaaaaaaaaaaaaaaaaaaaaaaaaaaaaaaaaaaaaaaa",
  "runId": "9b2c4d6e-1f3a-4b5c-8d7e-0a1b2c3d4e5f",
  "runInputInterventions": 0,
  "runSettingsSha256": "aaaaaaaaaaaaaaaaaaaaaaaaaaaaaaaaaaaaaaaaaaaaaaaaaaaaaaaaaaaaaaaa",
  "schemaVersion": 1,
  "sensorToken": null,
  "stage": 2,
  "status": "running",
  "stepId": "2.2",
  "surface": "cli",
  "t": {
    "confirmed": 900,
    "exited": null,
    "lookStart": 0,
    "prepared": 12,
    "spawned": 950,
    "wallStart": "2026-10-20T09:00:00Z"
  },
  "timeToStartMs": 950
}
